SKU,Title,Barcode
KSJ280NFZ,Williamson KSJ280NFZ Kensaki Jig,22677322513
80LBX300YD-GR,TUFLINE XP 80LB X 300YD GREEN,87852980308
PMWSTS-SPK,Panther Martin 15 PMWSTS-SPK,23634351348
PMWSTS-SCH,Panther Martin 15 PMWSTS-SCH,23634351324
XJ60009,"P-Line XJ60009 Hex Bar Jig, 7"", 16 oz,",15789604257
PFGELTUN,"Pautzke PFGEL/TUNA Fire Gel, Tuna",53398008097
MMP30,"Maxima MMP30 Mini Pack, clear, 30lb",607272043317
MMP20,"Maxima MMP20 Mini Pack, clear, 20lb",607272043294
BPW008CD24,Bait-Pop BPW008CD24 Gold Live,
BPTO0025HT,The Original Fish Formula,198168076958
BPS0016CD24,Bait-Pop BPS0016CD24 Pink Live,
BPMM0018,Bait-Pop BPMM0018 Monkey Milk -,197644817122
BPLS0026HT,The Original Fish Formula,198168724910
BPLS0026CD24,The Original Fish Formula,198168659618
BPLS0026,The Original Fish Formula BPLS0026,198168223024